topic_id,doc_index,file_id,topic_weight,text_preview
21,1200,104-10194-10014_chunk_002,0.999844,cate signature secure clearance nature lalcutne mate signature chief fic united state government mrs. grim bldg personnel room building january o'connell james p. jr. administrative due nature assignm
21,1844,104-10291-10013_chunk_002,0.999839,beciriba led beceived standard form united state government miss k. haller draft deferment committee august james arthur nool clase local board notified u followsi clase eff aug. indefinitely mtandard
21,1825,104-10291-10002_chunk_003,0.999839,category category chun ina laa category category return official documentation cc orm hhg submit form cover hr rect submit form responsibility eaa category submit form remark and/or mistory nd comp ca
21,1482,104-10222-10000_chunk_003,0.999835,central intelligence space exclusive personnel action emplay dding fotz code statign integree hdqtry birin grade gdf lei code te expires special reference retirement data separation data code cv/ccat.
22,1866,104-10291-10022_chunk_002,0.99985,yes answer yes question give particular including court receive annuity united state district columbia government retirement pension compensation military naval service yes answer yes question give co
22,1494,104-10222-10002_chunk_005,0.999843,science adm. vice technique operation duty branch liaison title ass't chief applied physic nov. tot.mos grade salary duty overseas description duty planning pursuing research development device toohri
22,1223,104-10194-10023_chunk_003,0.999835,eapenence gained year ago pertinent work applying summarized block duty changed materially working employer separate block describe position include pertinent cates employment month year material subm
22,1487,104-10222-10000_chunk_008,0.999828,address board classification ved state blo military reserve status serial organization unit headquarters yes state geloo branch service clist decoration exclusive service ribsons citation official let
22,1179,104-10193-10079_chunk_008,0.999826,dress enige om aromusronger persona feforal mane depar war dept qash ec ssu/ct kind business engar hon te -u.s. government und employdes super description worksalary equ starting per annua secretary r
23,3698,180-10073-10093_chunk_002,0.99986,belief true correct complete declaration preparer taxpayer based preparer knowledge preparer signature taxpayer sign signature boek address zip code return part renter credit question answered march l
23,3699,180-10073-10093_chunk_003,0.99986,excess gain line line enter loss schedule form line otherwise enter zero reduce gain line extent loss line enter loss schedule form line otherwise enter zero add gain line reduce loss line extent gain
23,3702,180-10073-10093_chunk_006,0.99986,security a. principal business activity food service product snack bar b. business name street rural route example retail-hardware wholesale-tobacco services-legal manufacturing-furniture etc c. feder
23,3703,180-10073-10093_chunk_007,0.999858,choice two deduction method either itemize deduction take standard deduction explained instruction separate return husband wife medical dental expense compensated insurance otherwise medicine drug doc
23,3705,180-10073-10093_chunk_009,0.999857,amount payroll¨deduc- add item wage figuring amount-to-be-reported wage salary income tax return social security f.i.c.a rate includes hospital insurance benefit old-age survivor disability insurance 
24,2319,124-10180-10217_multirif_chunk_003,0.999834,tions meet british police authority jan fug sup ited official state meet earliest possible moment responsible mem- bers scotland yard knowl ed geable participation investigation death dr. mart luther 
24,2322,124-10180-10236_multirif_chunk_003,0.999834,tions meet british police authority jan fug sup ited official state meet earliest possible moment responsible mem- bers scotland yard knowl ed geable participation investigation death dr. mart luther 
24,2326,124-10180-10320_multirif_chunk_003,0.999834,tions meet british police authority jan fug sup ited official state meet earliest possible moment responsible mem- bers scotland yard knowl ed geable participation investigation death dr. mart luther 
24,2329,124-10180-10323_multirif_chunk_003,0.999834,tions meet british police authority jan fug sup ited official state meet earliest possible moment responsible mem- bers scotland yard knowl ed geable participation investigation death dr. mart luther 
24,2332,124-10180-10324_multirif_chunk_003,0.999834,tions meet british police authority jan fug sup ited official state meet earliest possible moment responsible mem- bers scotland yard knowl ed geable participation investigation death dr. mart luther 
25,1788,104-10266-10138_chunk_005,0.999848,elite treference numbery pica toate time cite director mexico city liring mexico city additional rqms cuban requirement free world purchase urgent amount foreign exchange available year sugar crop ite
25,919,104-10178-10154_chunk_003,0.99984,job digepol rafael tremols fresneda gustava ortiz faez september state uncertain returning caracas say digepol job pay per month claim little live caracas actively seeking job miami case officer comme
25,854,104-10176-10075_chunk_002,0.999836,cub pemain mexico work administrator mexican company brother presently employed considerable pressure put vealthy mexican benefactor two owns company getting along year health beginning fail suffering
25,1444,104-10220-10128_chunk_003,0.999776,classify file sils aid art branch destroy dig action jafo classified hessage person/unit motified rid total cop advance fleur idoved lotte reproduction prohibited unit secret cite jmwave director cara
25,430,104-10123-10019,0.99505,brig jerry seigel late march message form total routing and/or initial seen secret ost index return per sop file c file ¡able secretariat dissemination onf eur file vr classification branch file rid t
26,224,104-10100-10034,0.998396,nov. king c pili non hulti director info sa cc c/dc dop adop cl/ops citoa fi ee ne ce wh pouch fran bonn brln muni atre multi-addressee perumen zrprima cedar lond pari brus hagu cope stoc oslo madr ro
26,184,104-10077-10153,0.998377,sa addressel sel deferred cent ci gi/ops coa fi el fouch fran bonn bren kai multi-addressee paulon zrprima pari brus hagu cope stoc oslo madr cible sec pls pouch wrence pouce ppan frob bonn hamb prin 
26,2247,104-10527-10212,0.998312,nov. multi adigroses ske rom director sa inf cc cdp adop citoa fi de pouch fran bonn brln mai gta ne atge acc multi-addressee de cet routine perumen zrprima lond pari brus hagu cope stoc oslo hadr row
26,1040,104-10183-10233,0.996446,bjp√ apimere return cia background int fet rfts index file c file paris rom frankfurt director conf c/we info ddp adop c/ci c/fi c/tsd c/ee dc/wh/sa vr iild info rome fran pari desensitized keyway per
26,1010,104-10182-10052_chunk_002,0.994524,wrote reply odacid dec merely answered odacid query previously reported hq belief trip ok intersting odunit debrief v. counit rep told peprime might helt sale aircraft even fighter aircraft joint goc/
27,2710,124-10273-10008_multirif_chunk_001,0.999858,alan g. sentinella set ag senstudy represents writer recollection testimony given senate select committee ssc pursuant subpoena session commenced a.m. former room caroll arm hotel present senator robe
27,2716,124-10273-10012_multirif_chunk_001,0.999858,alan g. sentinella set ag senstudy represents writer recollection testimony given senate select committee ssc pursuant subpoena session commenced a.m. former room caroll arm hotel present senator robe
27,2722,124-10273-10014_multirif_chunk_001,0.999858,alan g. sentinella set ag senstudy represents writer recollection testimony given senate select committee ssc pursuant subpoena session commenced a.m. former room caroll arm hotel present senator robe
27,2728,124-10273-10016_multirif_chunk_001,0.999858,alan g. sentinella set ag senstudy represents writer recollection testimony given senate select committee ssc pursuant subpoena session commenced a.m. former room caroll arm hotel present senator robe
27,2734,124-10273-10018_multirif_chunk_001,0.999858,alan g. sentinella set ag senstudy represents writer recollection testimony given senate select committee ssc pursuant subpoena session commenced a.m. former room caroll arm hotel present senator robe
28,2022,104-10326-10067,0.996517,frp staff conf c/occ info c/orms ctc/ieb ctc/ifc ctcarchive eur/lgl eur/sa limito mdsx occ/osg odpd file c/pcs asp tot oct director staff priority vienna director limit chief/occ info occ/osg chief/pc
28,2017,104-10326-10062,0.996331,frp staff conf c/occ info c/orms d/ogc ea/tib limito mdsx occ/osg odpd ogc/ld file c/pcs asp tot nov director staff το priority bangkok director limit chief/occ info occ/osg chief/pcs ogc/ld ogc/ofld 
28,2210,104-10433-10209_chunk_013,0.978089,reporter december mansfield michael j. eulogy late president john pitzgerald kennedy delivered rotunda united state capitol november britain conn. j.l kapica john fitzgerald kennedy eulogy lore presid
28,2201,104-10433-10209_chunk_004,0.970402,n bourgeois democracy right deny right current digest spyfet press january tragedy tablet november pp assassination nevevack august pp ived second installment death president time january j. tammey fu
28,2202,104-10433-10209_chunk_005,0.955537,h. comp preliminary inventory president com assassination president kennedy washington national archive recorda servica ceneral service administration jones fann forgive grief critical warren commissi
29,2676,124-10271-10013_chunk_006,0.999853,hold hearing shortly possibly prior time ssc get underway present time elliff know agreement plan provide hsc intelligence community ssc furnished department justice according elliff kevin t. maroney 
29,2653,124-10271-10003_chunk_003,0.999853,buchen requested fbi draft proposed intelligence charter bureau felt helpful administration proposal available might counter recommendation committee end meeting wilderotter asked second paper prepare
29,2659,124-10271-10003_multirif_chunk_003,0.999853,intelligence pointed earlier writing indicate intends draft intelligence charter fbi perhaps entire intelligence community elliff comprehensive study past several year bureau internal security intelli
29,2666,124-10271-10011_multirif_chunk_003,0.999853,intelligence pointed earlier writing indicate intends draft intelligence charter fbi perhaps entire intelligence community elliff comprehensive study past several year bureau internal security intelli
29,2686,124-10271-10299_multirif_chunk_003,0.999853,intelligence pointed earlier writing indicate intends draft intelligence charter fbi perhaps entire intelligence community elliff comprehensive study past several year bureau internal security intelli
30,3628,180-10068-10310,0.999681,assassination board final determination notification agency hsca series staff payroll agency file december status postponed part release previously postponed reason board action board decision premise
30,3646,180-10068-10334,0.999644,assassination board final determination notification agency hsca series staff payroll agency file december status postponed part release previously postponed reason board action board decision premise
30,3693,180-10071-10001,0.99962,assassination board final determination notification agency series hsca staff payroll agency file december status postponed part release previously postponed reason board action board decision premise
30,3596,180-10060-10468,0.99962,assassination board final determination notification agency hsca series agency file staff payroll december status postponed part release previously postponed reason board action board decision premise
30,3615,180-10060-10494,0.999606,assassination board final determination notification agency hsca series staff payroll agency file december status postponed part release previously postponed reason board action board decision premise
31,1452,104-10221-10002_chunk_005,0.998198,condte.delovimiento de lovicnbro orga nización de guerrilla guatemalteca nov. jose miguel fernandez reunirse roa dic jose miguel fernandez reunirse roa reunirse ene edmundo jardon ene raul fernandez r
31,2014,104-10326-10058,0.973569,intel dissem per sop frp intel conf iid/noprnt info eur/bcir eur/ib iidirps intelout la/cog la/mcgcen mdsx ncreport nr/ex odpd odpr file isr tot jan director secret intel director houston miami havana
31,2015,104-10326-10059,0.962953,form agency agency cia series agency file jfk project file cia headquarters withheld title withheld restriction last opening criterion comment escalante font paper textual deletion cia correspondence 
31,2016,104-10326-10060,0.955821,form agency agency cia series agency file jfk project file cia withheld director withheld title restriction last opening criterion comment escalante font paper textual deletion cia correspondence arrb
31,883,104-10177-10226_chunk_001,0.854879,outgoing message signal ceatealse caly foxx qmf class cation manoling indicatos conf info file cate-time gro message reference sidex doce return ples tq federal bureau investigation/attn r.k. mchargue
32,1594,104-10224-10012_chunk_005,0.999843,degree normal degree average degree outstanding degree characteristic appli- served rating get thing done resourceful accepts responsibility make decision need arises ni job without strong support xxx
32,1869,104-10291-10022_chunk_005,0.997642,stamen keep going long time wide range show originality accepts responsibility admits error responds well supervision even disposition able job without strong support category served apply applies lim
32,1213,104-10194-10019_chunk_004,0.979287,time filled fitness report employee serial name lost refiardson general firal middle jan sex grade official position title ops officer check appointment diver assignment current check report paris car
32,1567,104-10224-10004_chunk_003,0.966459,sade employne improvement work give recommendation training describe appropriate potential development assuming greater sponsibilitiet amplify explain appropriate rating given provide best basis för d
32,1163,104-10193-10075_chunk_003,0.949199,performance specific duty list six important specific duty performed rating period insort rating best describes manner employen performs specific duty consider effectiveness performance duty employee 
