topic_id,doc_index,file_id,topic_weight,text_preview
0,3448,157-10014-10242_chunk_008,0.999859,came lumberjack refrigeration repairman .right refrigerator refrigeration-air conditioning repairman alright husband two agent went floor right stationed going lookout hallway service entrance service
0,1464,104-10221-10004_chunk_006,0.999844,embassy find locate valentin cucherov meet another vc like perhaps monday vkg monday arrange time phone monday morning april niric vrg answer cucherov phoned found press conference miric say correspon
0,1465,104-10221-10004_chunk_007,0.993804,reson bmilio célombo name dominican exilea mexico vkghad news north peopla evident effort newa anitting pacify latin american speaking naming provisional president se à. yoca set weasin talking rehal 
0,875,104-10177-10217_chunk_001,0.963365,ret jan sta tc blvj secret af staff cite director ayat line laboda assi lanreace fil turis fdrill knoxer mathen ffa march elgen qr district colo district colant reposentatives esip requested whatever 
0,794,104-10174-10071_chunk_007,0.865624,veranstaltung die wahlen der su ein fest de sowjesvolkes 'mitwirkender die solistenvereinigung de berl rundfunks unter leitung von nationalpreistrager heimet koch robert trösch und da billett dai verl
1,1006,104-10182-10004_chunk_005,0.983838,mentioned held back thought mother wife feeling even need repeated approach jean adam coersion get restraining influence wife debriefing although left full freedom tell story feel live show excitement
1,772,104-10174-10065_chunk_006,0.977832,apartment 'll go want attend course english week 'll busy log ok next conversation appeared gaziyev probably talking since gaziyev taking spanish mexican-north american institute knew gaziyev class oc
1,1005,104-10182-10004_chunk_004,0.947784,tellier yourgest backed liinzini fut david show manliness went upstairs woman asked franc woman asked le room cold water cold nearly lost penis help woman managed felt proud returned others however si
1,1362,104-10217-10221_chunk_004,0.945338,best opportunity develop natural cover gain natural access target area selectica case officer future handling- pending final decision/request katzenbach contact give retainer fee hundred dollar per we
1,1364,104-10217-10221_chunk_006,0.942729,academic related much life except plotter born conspirer love ten people around tell maneuver course whatever tell generally turn disastrous example so-called pro-chinese student inside ubc union de e
2,2261,104-10535-10001_chunk_002,0.999853,su viaje cuba donde estuvo con su esposo quince días narra lo siguiente los últimos días del de noviembre de dirigí cuba sin ser invitada cubriendo los gastos de transportación de mi propio peculio al
2,1137,104-10188-10001_chunk_003,0.999841,lo llamen întrada.- hrs.- chistir con muna para saber si opii el señor harila ai eoid lilleando con kid comba va esperar al vatu lo llamard porque lo quiaro coger como dé lugna hurada quiere preguntar
2,777,104-10174-10065_chunk_011,0.99984,requiera atención especial en caso afirmativo describala cuando tiene la piernas cruzadas se sienta quieto mave el pie mece hueve la pierna calea el suelo con el pie ¿se zece sobre los pie cuando está
2,1136,104-10188-10001_chunk_002,0.999839,al hijo del corunal hoja tres salida ocupada salida al hra.- bin contestación.- ocupada instituto cardiologia guzman pregunta por el dr. peguero de consulta externa dice esporo un momento im grullon s
2,823,104-10176-10006_chunk_004,0.999834,la naturaleza reviste un carácter social ya el hombre sólo puede llevarla cabo contrayendo determinadas relaciones socinles relaciones de producción en la praxis productiva además porque la modificaci
3,1913,104-10305-10000_chunk_005,0.968855,called effective way gaining lleoperations refuse publicly ch gra baton rouge novel talked four hour last night east baton rouge isha dist ally sargent pitchre arrival columbus offlo hying since selli
3,1912,104-10305-10000_chunk_004,0.830202,ärrest louisiana matter occurred entrance state comply subpena order dulles life york novel residing columbus ohio since fleeing louisiana last year call novel alleges associate isò diclaimed ferrie v
3,302,104-10106-10716,0.75562,segnet december schlumberger well surveying corporation houma munition bunker lease firm allegation garrison charged burglary houma munition bunker cia-inspired. issued arrest warrant gordon novel and
3,39,104-10059-10218,0.626452,sensitive february requests-from ober basic documentation circa subsequent second appearance rockefeller commission february ober returned headquarters afternoon february morning february continue fil
3,1931,104-10306-10025,0.549523,cia historical program release sanitized tru last month november sun mon tue wed thu fri sat next month january hse mity cancelled year eve party thursday december last month september october sun mon
4,3387,157-10014-10067_chunk_001,0.999864,form agency agency sscia series hearing agency file sscia tweedy bronson title congo assassination lumumba cia classification restriction transcript deletion last opening criterion comment item restri
4,3424,157-10014-10151_chunk_008,0.999864,departure unclear probably signifies biological substance lost toxicity nonetheless chief indicated gottlieb left biological substance still lethal intended proceed assassination operation sid left ce
4,3422,157-10014-10151_chunk_006,0.999863,castro regime castro personally laid special group augmented undertaken except authority group direction group time know evidence cia fact engaged period series attempt assassinate castro faced dilemm
4,3433,157-10014-10178_chunk_002,0.999863,oversight military program ica run defense department senior state department official involved area two different function reason setup area working cia intelligence matter somewhat different prior p
4,3339,157-10005-10297_chunk_002,0.999862,reconcile statement go ahead operation never imminent especially light tweedy prop next week told chief lumumba disposition spontaneously becomes consideration channel remains specific purpose discuss
5,2278,124-10179-10217_multirif_chunk_002,0.999863,attempt organize msrp unit recruit member letter purportedly complaint neighbor en longine street used violation residential zoning law mailed jackson jackson daily news 'jack sunn column letter point
5,2285,124-10179-10219_multirif_chunk_002,0.999863,attempt organize msrp unit recruit member letter purportedly complaint neighbor en longine street used violation residential zoning law mailed jackson jackson daily news 'jack sunn column letter point
5,2311,124-10179-10221_multirif_chunk_002,0.999863,attempt organize msrp unit recruit member letter purportedly complaint neighbor en longine street used violation residential zoning law mailed jackson jackson daily news 'jack sunn column letter point
5,2938,124-10274-10125_chunk_037,0.999857,armstrong xo herwig mrs. neenan rally repeal anti-abortion law federal building cleveland ohio public square cleveland ohio sponsored abortion project coalition apc cleveland ohio aug. twentyfive seve
5,2925,124-10274-10125_chunk_024,0.999857,last spokesman special event national capital park united state department interior washington d.c. notice proposed demonstration filed september twentyone last representative wonaac washington d.c. c
6,504,104-10150-10136_chunk_007,0.999854,ivanova told pregnant asked money abortion supervisor code clerk operation summary conclusion according nosenko transfer embassy operation american code clerk priority task thus important single respo
6,500,104-10150-10136_chunk_003,0.999851,directorate foreign intelligence directorate second chief directorate counterintelligence directorate designation later reversed month kruglov beriya successor comment beriya reversed designation firs
6,1265,104-10210-10021,0.999773,annex top secret study entitled examination bona fides kgb defector yuriy i. nosenko dated february study forwarded earlier certain portion annex study deleted since contains bear security ongoing via
6,2259,104-10534-10173_chunk_002,0.999477,asserted gribanov responsible sending geneva retracting claim gribanov played special role assignment asserted bannikov approved trip nosenko denies father gribanov acquainted annex february according
6,1284,104-10211-10001_chunk_005,0.996954,thought knowledgeability kgb code clerk operation main task prime reason moved u.s. embassy nosenko alleged supervise operational work american code clerk capacity closely guided work case officer gry
7,2586,124-10226-10305_chunk_004,0.997795,basis miami area mm businessman wide association criminal element miami area mm individual knowledge criminal element miami florida area mm supervisor agency conduct credit investigation obtain financ
7,2055,104-10330-10010,0.980083,david marwell executive director arrb john pereira cia/historical group mexico city/sensitive directorate operation prepared statement assist assassination board statement explains sensitivity related
7,2075,104-10331-10149,0.979856,april lee strickland chief irg/oim j. barry harrelson jfk project officer pending arrb issue exdir info brief covert action within ford presidential library referred material raise concern helm mfr pi
7,2076,104-10331-10152,0.964103,april deputy executive director via director management lee s. strickland chief group/oim pending arrb jfk board issue aiuo per request april bi-weekly meeting summarized significant issue deliberatio
7,2070,104-10331-10127,0.955166,chief historical group december fredrick c. wickham jr. focal point arrb position identification strongly opposes release arrb phrase good kubark asset previously withheld attachment cia asked nicarag
8,558,104-10163-10140_chunk_001,0.999844,routing sheet prior fluing fill peci beck deach back flap forward rid destoy bont cover sheet unless significant ection lakh commenta requiring preservation rom te action branch lenoland uile shown pr
8,540,104-10162-10248_chunk_001,0.999836,haterial reviewed cia headquarters house select committee assassination seder file title/number/volume inclusive custodial unit/location deletion received cate returned jul apaujo-bernal leopoldo room
8,147,104-10074-10006,0.999484,r. wagner sept le secretariat dissemination eur total ret incer return dranch idg file c file ile rid return cia background cilops rilan secury cilso clsa ipico classification time filed cite direct v
8,73,104-10064-10015,0.999426,r. wagner total cofies sept ae secretariat qisseminations index return branch file bid eur file idg file c file siloes rilan secury cilso iclassification time-filed elitet trefore cite direc brussels 
8,1441,104-10220-10074,0.993713,caution- blani foras req secure storage field natines regzest mu dispatch i̇ndeki̇ng regasted indeling chief latin america huo amature laro dashd qief er chief stockhola mnintel ream pc arrivals/depar
9,1936,104-10308-10029,0.976612,memurandum amcanoe steak job file included volume description project concern u.s. contact resistance group cuba support unidad de liberacion nacional uln plan effort overthrow castro principle player
9,1720,104-10232-10004,0.968493,cloned october meeting dr. miko cardona october dr. mirc arrived a. meeting sot driven secrotary introduced first meeting remained outside car meeting lasted noon first dr. miro handed note longland l
9,1739,104-10236-10056,0.967954,secret october meeting dr. miro cardona october dr. miro arrived a. m. meeting set driven secretary introduced first meeting remained outside car meeting lasted noon first dr. miro handed note longhan
9,254,104-10102-10232,0.956416,return cia background february nestor antonio moreno lopez moreno born august havana cuba father cuban senator cuban minister public work moreno became lawyer continued live comfortable circumstance b
9,261,104-10103-10108,0.956263,february nestor antonio moreno lopez moreno born august havana cuba father cuban senator cuban minister public work moreno became lawyer continued live comfortable circumstance became involved anti-ba
10,1108,104-10187-10014_chunk_004,0.999852,liempty project renewal request action required reference reference november january july january january mexico city march processing action marked indexing indexing required qualified desk judge ind
10,1106,104-10187-10014_chunk_002,0.999852,pattern activity association liempty able report accurate change certain specific case liempty coverage showed nikitin mentioned paragraph changed activity pattern defection raisa yerofeyevna kiselnik
10,1110,104-10187-10014_chunk_006,0.994378,destruction cite reason airi coordinate appropriate form previous edition replaces form obsolete c secret uk continued socket cryptonym operating liempty field mexico city target area mexico headquart
10,1111,104-10187-10014_chunk_007,0.97777,requested paragraph project amendment disapproved clackett contract agent quarter allowance turned high relation clackett salary therefore quarter allowance approved written clacketi contract however 
10,1134,104-10188-10000_chunk_006,0.94672,live situation constant potential danger d. status pproved commitment lifeat project approved cantairs element necessary fiscal main difference noted field project outline cost higher base nouse added
11,1602,104-10225-10000_chunk_003,0.970415,nature security problem call kind security scrutiny necessary radio free europe h. feue excellent source cia consequence captain sabalov make available agency list applicant free university biographic
11,3463,157-10014-10242_chunk_023,0.885456,note title indicates intent part congress occupy field provision operates exclusion law state possession political subdivislon state possession matter relieve person obligation imposed law state posse
11,1603,104-10225-10000_chunk_004,0.847764,understand fallacy system seduces forced serve short rfe wishow direct czechculovaks czechoslovakia pole poland hungari .ns hungary enlightened self-interest respective nation fact enlightened self-in
11,1607,104-10225-10000_chunk_008,0.839798,dhi road tock look nofe hatigy july director central intelligenc d'arcy brophy louis hovies trip europa brophy novins tell agreed pay expense trip burge told since traveling business draw tha money he
11,1601,104-10225-10000_chunk_002,0.793169,germany contact poland might lead friend behind curtain seguft security betray unnecessarily tragically heard people promoted behind curtain whispering campaign among pole time recent election effect 
12,3507,176-10036-10149,0.999045,form agency nara series national security file agency file cia title cia report classification restriction last opening criterion comment national security file box cia report box telegram report tele
12,3504,176-10036-10139,0.997134,form agency nara series national security file agency file cia title cia report classification restriction last opening criterion comment national security file box vietnam cia report box syninzed via
12,3488,176-10036-10097,0.996485,form agency nara series national security file agency file cia title central intelligence agency report classification restriction last opening criterion comment national security file box vietnam box
12,3538,177-10002-10105,0.971604,form agency agency lbj series nsf cf ussr vol box agency file cia title special report weekly classification restriction last opening criterion intelligence report paper textual consulted mandatory ma
12,3481,176-10036-10079,0.968838,form agency nara series national security file agency file cia title possible severence cambodian classification restriction last opening criterion comment national security file box vietnam box teleg
13,912,104-10178-10120,0.996438,bouting mutials seen message poam richard ober exit april secretariat dissemination per dele compi total come destroy return branch pre index file ci file impo rid file c/eur c/wh cife cine sdo dessif
13,128,104-10071-10407,0.996147,qugi uniti diy richard ober bar april secretariat dissexunation confi bouring tials seen potal comth exdex ofilk impon rd far destroy beturn branch exder file ci pale dce d/dce dop addc cs/re cite dir
13,132,104-10072-10046,0.98582,message form total.copiest routing and/ initial seen fame bur ame secretamay disseminat meinek xyday sop secr crets delhe secre bxdex exfor rid destro return file c file ddp addp time filed dumber cit
13,717,104-10172-10256,0.981026,outgoing messa omf stock clasification message manỡláng đidicator staff conf info file group director directo stockholny dissem ose per yoxes unintel cktop tiblock ref director pedonor queried pd dipp
13,1084,104-10186-10008,0.977628,co cos/uenos aire cos/guatemala city cos/la paz cos/exico city cos/panama city cob/porto alegre cos/port au spain cos/port au prince cob recife cos/rio de janeiro cos/san jose cos/san salvador cos/san
14,2850,124-10273-10289_redacted_chunk_072,0.99986,marxist-leninist line thought advocate revolution meeting broke hampton rejoined bodyguard bpp member peoria illinois left ballroom approximately person attendance per cent negro incident arrest time 
14,2843,124-10273-10289_redacted_chunk_065,0.99986,content distributed outside agency louis randolph williams anti-riot law rush furnished instruction robert alonzo brown fred hampton maurice monley joseph l. montgomery clarence price set instruction 
14,2838,124-10273-10289_redacted_chunk_060,0.99986,issue black panther regularly contain quotation writing chairman mao tse-tung people republic china feature mao statement political power grows barrel gun national headquarters bpp located shattuck av
14,2839,124-10273-10289_redacted_chunk_061,0.99986,reason failed attend alleged secret meeting bpp lawyer survivers rehearse say inquest allegedly truelock claim attempted awaken hampton agreement johnson bell testimony bobby rush deputy minister defe
14,2821,124-10273-10289_redacted_chunk_043,0.994945,agency follows indicated willie calvin raymond hewit clarence terry travel bpp leader calvin assigned hewitt companion known t.c security guard came buy u.s. saving bond regularly payroll saving rma d
15,2797,124-10273-10289_redacted_chunk_019,0.954965,intelligence responsibility recommendation evaluation submitted december recommended program continued present form wes doeld attachment technical surveillance maintained specific request specific app
15,2804,124-10273-10289_redacted_chunk_026,0.948793,explore accurately potential coverage regard african country suggest coverage time four additional country republic congo leopoldville guinea mali morocco congo key trouble spot africa guinea mali lea
15,2803,124-10273-10289_redacted_chunk_025,0.945084,set castro-type militia observation view political development morocco hendicated believed institute program develop source informant moroccan diplomatic establishment \in united state purpose obtaini
15,2798,124-10273-10289_redacted_chunk_020,0.934463,since enclosure iraq embassy washington d. c. israel embassy ashington d. c. consulat nyc mexico chancer washington d. c. nicaragua chancery washington d. c. panama chancery washington d. c. yugosla i
15,2780,124-10273-10289_redacted_chunk_002,0.87506,coverage providing u recent week material immensely valuable u keeping abreast fast-moving event development international situation great assistance formulation policy 'd-reading view keen interest e
16,2292,124-10179-10220_chunk_002,0.999855,caused gun battle however electronic surveillance allowed advance planning cut risk arresting officer bystander electronic surveillance student democratic society headquarters chicago illinois provide
16,2862,124-10274-10001_multirif_chunk_002,0.924627,adm. dep ad inv intell logél coun plan eval kay doug marvin assistant attorney general apprised fact intended affix property stamp certain nonclassified furnishing senate select committee ssc explaine
16,2750,124-10273-10071_multirif_chunk_002,0.924626,adm. dep ad inv intell logél coun plan eval kay doug marvin assistant attorney general apprised fact intended affix property stamp certain nonclassified furnishing senate select committee ssc explaine
16,2759,124-10273-10086_multirif_chunk_002,0.924625,adm. dep ad inv intell logél coun plan eval kay doug marvin assistant attorney general apprised fact intended affix property stamp certain nonclassified furnishing senate select committee ssc explaine
16,2853,124-10274-10001_chunk_002,0.903233,assistant special agent charge special agent supervisor percent total agent special agent personnel classified exempt gd category declassification indefinite enclosure optional form edition gsa gen. r
17,2810,124-10273-10289_redacted_chunk_032,0.999859,people medical clinic satisfy medical need community understand capital ists america-will never provide adequate medical service black panther party moved establish another com- technical assistance s
17,2814,124-10273-10289_redacted_chunk_036,0.983542,kathleen cleaver since murder black panther treasurer bobby hutton jailing innumerable panther including eldridge cleaver course leader huey newton support membership panther party increased geometric
17,117,104-10071-10102,0.873815,info info dispatch chief womuse chief european chief oslo action required reference ntp transmittal clipping processing action marked indexing indexing required qualified desk judge indexing microfilm
17,2982,124-10276-10483_multirif_chunk_003,0.847341,illigence activity ssc bd ivil former fbi ploke dy ssc ir frustrong recall whether ir gray ir volt go safo together whether i. felt alone advise tir grey finding regard present location file r. lamotr
17,2827,124-10273-10289_redacted_chunk_049,0.842896,eventually replace capitalist system objective law independent man however much reactionary try hold back wheel history sooner later revolution take place inevitably triumph mao tse-tung marxism consi
18,2720,124-10273-10012_multirif_chunk_005,0.949869,bureau regarding cointelpro pertains bpp request list local police department personnel contacted list medium person contacted list fbi personnel connected program present location investigative respo
18,2744,124-10273-10022_multirif_chunk_005,0.949869,bureau regarding cointelpro pertains bpp request list local police department personnel contacted list medium person contacted list fbi personnel connected program present location investigative respo
18,2738,124-10273-10018_multirif_chunk_005,0.949869,bureau regarding cointelpro pertains bpp request list local police department personnel contacted list medium person contacted list fbi personnel connected program present location investigative respo
18,2964,124-10274-10357_multirif_chunk_005,0.949868,bureau regarding cointelpro pertains bpp request list local police department personnel contacted list medium person contacted list fbi personnel connected program present location investigative respo
18,2970,124-10274-10358_multirif_chunk_005,0.949868,bureau regarding cointelpro pertains bpp request list local police department personnel contacted list medium person contacted list fbi personnel connected program present location investigative respo
19,3173,144-10001-10125,0.99955,doc top secret umbrate agency nsa form agency series agency file nsa lowman david sa/sdsofd title sscsgo-assassination oswald lee proposed russian trip textual classification restriction last opening 
19,3121,144-10001-10068,0.998067,top secre cret umbraate form agency nsa agency series agency file nsa nsa title sigint daily summary twenty cuba military activity cuba diplomatic activity report textual classification restriction la
19,3184,144-10001-10166,0.997692,oevng doc ref id gret form agency agency nsa series agency file nsa nsa title castro speaks pres kennedy assassination cuba u blaming cuba assassination report classification restriction last opening 
19,3187,144-10001-10169,0.997526,doc ref id agency nsa poke form agency series agency file nsa nsa hco title alert oriente province believed terminated termination oriente alert report classification restriction last opening criterio
19,3134,144-10001-10083,0.997379,doc ref id agency nsa form agency series agency file nsa nsa restricted title restricted str ect restricted report classification restriction last opening criterion agency determination required comme
20,2459,124-10190-10075_chunk_040,0.99986,regarding arrest publicity regarding fbi fugitive extreme care taken avoid statement brand fugitive guilty crime convicted arrest data identify photograph connection past arrest imprisonment appear ph
20,2426,124-10190-10075_chunk_007,0.999859,technical reference statute express personal opinion reveal identity confidential informant bureau expression like bureau prepare interesting case write-ups juvenile sex offender parole violator submi
20,2454,124-10190-10075_chunk_035,0.999858,detect failure receive latest manual revision table content part cop part ii la enclosure truly john edgar hoover director part ii publication press public contact fbi law enforcement bulletin publica
20,2428,124-10190-10075_chunk_009,0.999857,violator interstate transportation stolen property unlawful flight avoid prosecution unlawful flight avoid confinement unlawful flight avoid giving testimony bureau still promptly bank robbery interst
20,2424,124-10190-10075_chunk_005,0.999857,release file exists connection service award bureau personnel sac provide news medium photograph brief biographical sketch employee employee submit personal interview newsman connection award circumst
21,1863,104-10291-10021_chunk_001,0.999846,ref ation establishment cancellation official cover backstop lef control op chief contract personnel op chief pcs/css operating component action attn support staff apr employee card retirement cia sta
